OMBControlNumber,ICRReferenceNumber,REQUEST_TYPE_ABBR,ParentAgencyCode,ParentAgencyAcronym,ParentAgencyName,AgencyCode,AgencyAcronym,AgencyName,ICRTitle,ICTitle,CommonFormFlag,ConcludedDate,ExpirationDate,Abstract,documentType,OtherType,FormNumber,FormName,OriginalFileName,URL,AvailableElectronically,CanSubmittedElectronically,ElectronicCapability,LineOfBusiness,Subfunction,PublicCode
1615-0007,201107-1615-010,ICR Ext,1600,DHS,Department of Homeland Security,1615,USCIS,U.S. Citizenship and Immigration Services,Alien Change of Address Card,Alien's Change of Address Card,No,12/11/11,12/31/14,"Section 265 of the Immigration and Nationality Act (INA) requires aliens in the United States to inform USCIS whenever there is a change in their address.  Form AR-11 is used to inform USCIS whenever there is a change of address.  AR-11SR is used by nonimmigrants subject to the ""Special Registration"" requirements to report changes of address, employer, or school to USCIS.      ",Form and Instruction, ,AR-11,Alien's Change of Address Card,AR-11 Rev 10-27-2011.pdf,uscis.gov,Yes,Yes,Fillable Fileable,Homeland Security,Border and Transportation Security,Individuals or Households
1615-0001,201202-1615-002,ICR Ext,1600,DHS,Department of Homeland Security,1615,USCIS,U.S. Citizenship and Immigration Services,Petition for Alien Fiance(e),Petition for Alien Fiance(e),No,6/22/12,6/30/13,"To date, through the filing of this form a U.S. citizen may facilitate the entry of his/her spouse or fiance(e) into the United States so that a marriage may be concluded within 90 days of entry between the U.S. citizen and the beneficiary of the petition.  This form must be used to cover the provisions of section 1103 of the Legal Immigration Family Equity Act of 2000 which allows the spouse or child of a U.S. citizen to enter the U.S. as a nonimmigrant.  The I-129F is the only existing form which collects the requisite information so that an adjudicator can make the appropriate decisions.",Form, ,I-129F,Petition for Alien Fiance(e),I-129f form 8-2-2011.pdf, ,Yes,No,Fillable Printable,Homeland Security,Border and Transportation Security,Individuals or Households
1125-0010,200903-1125-001,ICR Rev,1100,DOJ,Department of Justice,1125,EOIR,Executive Office for Immigration Review,Notice of Appeal to the Board of Immigration Appeals from a Decision of a USCIS Officer,Notice of Appeal to the Board of Immigration Appeals from a Decision of a USCIS Officer,No,10/16/09,10/31/12,"Party affected by USCIS officer decision may appeal to Board of Immigration Appeals, provided Board has jurisdiction under 8 CFR 1003.1(b). Party must complete Form EOIR-29 and submit to USCIS office with administrative control over record.      ",Form, ,EOIR-29,Notice of Appeal to the Board of Immigration Appeals from a Decision of a USCIS Officer,New OMB EOIR-29 final template 04-23-09.pdf,http://www.usdoj.gov/eoir/eoirforms/eoir29_0209.pdf,Yes,No,Fillable Printable,General Government,Legislative Functions,Individuals or Households
1651-0107,201106-1651-001,ICR Ext,1600,DHS,Department of Homeland Security,1651,USCBP,U.S. Customs and Border Protection,Application for Waiver of Passport and/or Visa,Application for Waiver of Passport and/or Visa,No,9/5/11,9/30/14,DHS Form I-193 is used by an aliens who wishe to waive the documentary requirements for passports and/or visas due to an unforeseen emergency.  CBP uses this information to determine whether the applicant is eligible for entry into the United States.      ,Form, ,I-193,Application for Waiver of Passport and/or Visa,CBP_Form_i193.pdf,http://forms.cbp.gov/pdf/CBP_Form_i193.pdf,No, ,Fillable Printable,Homeland Security,Border and Transportation Security,Individuals or Households
0960-0784,201101-0960-005,ICR Ext,0960,SSA,Social Security Administration,0960,SSA,Social Security Administration,Medicare Income-Related Monthly Adjustment Amount - Life-Changing Event,Paper Form (mailed),No,7/29/11,7/31/14,"Per the Medicare Modernization Act of 2003, selected Medicare insurance recipients pay an income-related monthly adjustment amount (IRMAA).  The Internal Revenue Service (IRS) transmits income tax return data to SSA for SSA to determine the amount of IRMAA.  SSA will use the new Form SSA¿44 to determine if a recipient qualifies for a reduction in IRMMA.  If affected Medicare recipients believe SSA should use more recent tax data because a life-changing event occurred that significantly reduces their income, they can report these changes to SSA and ask for a new initial determination of their IRMAA.In this ICR, we are seeking full OMB approval for the collection which we cleared on an emergency basis several months ago.",Form and Instruction, ,SSA-44,Medicare Income-Related Monthly Adjustment Amount - Life-Changing Event,SSA-44.pdf, ,No, ,Printable Only,Income Security,General Retirement and Disability,Individuals or Households
